{
  "schema_version": "vllm-runtime-snapshot-1.0",
  "model_revision": "aaaaaaaaaaaaaaaaaaaaaaaaaaaaaaaaaaaaaaaa",
  "hardware_id": "example-accelerator-x8-288gb",
  "runtime_version": "example-pinned-image",
  "tensor_parallel_size": 8,
  "data_parallel_size": 1,
  "expert_parallel_size": 8,
  "physical_device_count": 8,
  "memory_utilization_limit": 0.96,
  "kv_cache_dtype": "fp8",
  "block_size_tokens": 1536,
  "max_num_seqs": 24,
  "context_tokens": 1048576,
  "kv_cache_size_tokens": 25165824,
  "kv_cache_max_concurrency": 24.0,
  "workers": [
    {
      "worker_rank": 0,
      "device_memory_bytes": 309237645312,
      "requested_memory_bytes": 296868139500,
      "model_memory_usage_bytes": 64424509440,
      "peak_activation_memory_bytes": 4294967296,
      "available_kv_cache_memory_bytes": 226001179116
    },
    {
      "worker_rank": 1,
      "device_memory_bytes": 309237645312,
      "requested_memory_bytes": 296868139500,
      "model_memory_usage_bytes": 64424509440,
      "peak_activation_memory_bytes": 4294967296,
      "available_kv_cache_memory_bytes": 226001179116
    },
    {
      "worker_rank": 2,
      "device_memory_bytes": 309237645312,
      "requested_memory_bytes": 296868139500,
      "model_memory_usage_bytes": 64424509440,
      "peak_activation_memory_bytes": 4294967296,
      "available_kv_cache_memory_bytes": 226001179116
    },
    {
      "worker_rank": 3,
      "device_memory_bytes": 309237645312,
      "requested_memory_bytes": 296868139500,
      "model_memory_usage_bytes": 64424509440,
      "peak_activation_memory_bytes": 4294967296,
      "available_kv_cache_memory_bytes": 226001179116
    },
    {
      "worker_rank": 4,
      "device_memory_bytes": 309237645312,
      "requested_memory_bytes": 296868139500,
      "model_memory_usage_bytes": 64424509440,
      "peak_activation_memory_bytes": 4294967296,
      "available_kv_cache_memory_bytes": 226001179116
    },
    {
      "worker_rank": 5,
      "device_memory_bytes": 309237645312,
      "requested_memory_bytes": 296868139500,
      "model_memory_usage_bytes": 64424509440,
      "peak_activation_memory_bytes": 4294967296,
      "available_kv_cache_memory_bytes": 226001179116
    },
    {
      "worker_rank": 6,
      "device_memory_bytes": 309237645312,
      "requested_memory_bytes": 296868139500,
      "model_memory_usage_bytes": 64424509440,
      "peak_activation_memory_bytes": 4294967296,
      "available_kv_cache_memory_bytes": 226001179116
    },
    {
      "worker_rank": 7,
      "device_memory_bytes": 309237645312,
      "requested_memory_bytes": 296868139500,
      "model_memory_usage_bytes": 64424509440,
      "peak_activation_memory_bytes": 4294967296,
      "available_kv_cache_memory_bytes": 226001179116
    }
  ]
}
